### ISSUE TITLE
NMP refusing to connect when using SOCKS/HTTP Proxies

### ISSUE THREAD

**Issue by JorgenVatle** [PrismarineJS/node-minecraft-protocol#488]
I can't seem to get any of the proxy stream functionality to work. Whenever a client is created with a proxy, the application will simply hang up and stay hung up until something times out.

I've tried with SOCKSv5 proxies:
```javascript
var mc = require('minecraft-protocol');
var socks = require('socks5-client');

var client = mc.createClient({
    stream: socks.createConnection({
        socksHost: '151.80.**.**',
        socksPort: 1080,
        host: 'my.server.com',
        port: 25565
    }),
    username: '<my username>',
    password: '<my password>'
});
```
HTTP proxies:
```javascript
var mc = require('minecraft-protocol');
var http = require('http');

var req = http.request({
    host: '104.140.**.**',
    port: 8080,
    method: 'CONNECT',
    path: 'my.server.com:25565'
});
req.on('connect', function(res, stream) {
    mc.createClient({
        stream: stream,
        username: '<my username>',
        password: '<my password>'
    });
});
```

And even with a SOCKS proxy through the Minecraft proxy server example, but encountered the same error as in #436. To be clear, this issue is not about what's referenced in #436.

From my testing, I've found that the proxy server is hit by NMP, and the proxy server communicates with the targeted Minecraft server. But that is where communication ends and NMP hangs. I've tested and ensured that the SOCKS proxy does work properly with a standalone Minecraft client.
Outputs on connection attempt: [NMP output](https://i.gyazo.com/17a93810e31350520d43bd6c2a2ce121.png), [Proxy output](https://i.gyazo.com/134f8eeacc9bee9c522fcaed3cfb8187.png)

When testing with an HTTP proxy, I get this: [https://i.gyazo.com/4987d8bdcf8c68979c1d1afb1844884a.png](https://i.gyazo.com/4987d8bdcf8c68979c1d1afb1844884a.png) That may be due to the proxy I used, or due to a misconfiguration, I'm not sure.

**EDIT:** I'm on release 1.1.3

**Comment by roblabla** [comment]
What proxy server software is this ? Could you get a packet dump with wireshark or something ? It's really hard to make heads and tails of this issue, since our proxy support is really, really "dumb". We're really not doing much, so I don't see what could cause it to fail.

**Comment by roblabla** [comment]
To expand : when you give a stream to NMP (instead of a host/port), we simply [bypass the usual connection setup](https://github.com/PrismarineJS/node-minecraft-protocol/blob/master/src/client/tcp_dns.js#L9-L10).

**Comment by JorgenVatle** [comment]
I'm using SS5 Socks Server for Linux.

I'll see if I can get you that packet dump in a bit.

**Comment by JorgenVatle** [comment]
Alright, I got a dump from an OpenSSH proxy server on Ubuntu. Here's a log from Tcpdump with extra-verbose logging.

I've masked host addresses with `188.25.**.**.address_masked.tld`
```
18:15:33.395708 IP 188.25.**.**.address_masked.tld.53086 > 192.168.1.160.socks: Flags [S], seq 681255309, win 64240, options [mss 1440,nop,wscale 8,nop,nop,sackOK], length 0
18:15:33.395817 IP 192.168.1.160.socks > 188.25.**.**.address_masked.tld.53086: Flags [S.], seq 1242320995, ack 681255310, win 29200, options [mss 1460,nop,nop,sackOK,nop,wscale 7], length 0
18:15:33.531430 IP 188.25.**.**.address_masked.tld.53086 > 192.168.1.160.socks: Flags [.], ack 1, win 258, length 0
18:15:33.531654 IP 188.25.**.**.address_masked.tld.53086 > 192.168.1.160.socks: Flags [P.], seq 1:4, ack 1, win 258, length 3
18:15:33.531693 IP 192.168.1.160.socks > 188.25.**.**.address_masked.tld.53086: Flags [.], ack 4, win 229, length 0
18:15:33.531852 IP 192.168.1.160.socks > 188.25.**.**.address_masked.tld.53086: Flags [P.], seq 1:3, ack 4, win 229, length 2
18:15:33.659564 IP 188.25.**.**.address_masked.tld.53086 > 192.168.1.160.socks: Flags [P.], seq 4:26, ack 3, win 258, length 22
18:15:33.697108 IP 192.168.1.160.socks > 188.25.**.**.address_masked.tld.53086: Flags [.], ack 26, win 229, length 0
18:15:33.752689 IP 192.168.1.160.socks > 188.25.**.**.address_masked.tld.53086: Flags [P.], seq 3:13, ack 26, win 229, length 10
18:15:33.918183 IP 188.25.**.**.address_masked.tld.53086 > 192.168.1.160.socks: Flags [.], ack 13, win 258, length 0
18:16:03.840227 IP 192.168.1.160.socks > 188.25.**.**.address_masked.tld.53086: Flags [F.], seq 13, ack 26, win 229, length 0
18:16:03.966147 IP 188.25.**.**.address_masked.tld.53086 > 192.168.1.160.socks: Flags [.], ack 14, win 258, length 0
18:16:03.966269 IP 188.25.**.**.address_masked.tld.53086 > 192.168.1.160.socks: Flags [F.], seq 26, ack 14, win 258, length 0
18:16:03.966290 IP 192.168.1.160.socks > 188.25.**.**.address_masked.tld.53086: Flags [.], ack 27, win 229, length 0
```

**Comment by roblabla** [comment]
We would need the full dump file. You can send it to me by email at `unfiltered at roblab.la` if you wish to stay private :).

**Comment by JorgenVatle** [comment]
Alright, I'll send over some more detailed logs shortly. 👍

**Comment by JorgenVatle** [comment]
Sent them over about an hour ago. 😄

**Comment by rom1504** [comment]
now fixed, see the new examples
